{
  "schema_version":"1.0","scenario_id":"target-continuity",
  "uavs":[
    {"id":"uav-continuity","position":{"x":0,"y":0},"status":"BUSY","capabilities":["TARGET_TRACKING"],"battery_percent":75,"link_quality":0.8,"current_workload":1,"max_workload":2,"max_task_distance":1500,"current_target_id":"target-alpha"},
    {"id":"uav-nearby","position":{"x":450,"y":450},"status":"AVAILABLE","capabilities":["TARGET_TRACKING"],"battery_percent":75,"link_quality":0.8,"current_workload":0,"max_workload":2,"max_task_distance":1500,"current_target_id":null}
  ],
  "targets":[{"id":"target-alpha","position":{"x":500,"y":500},"priority":"CRITICAL","status":"TRACKED","required_capabilities":[],"continuity_uav_id":"uav-continuity"}],
  "regions":[],
  "mission_requests":[{"id":"maintain-track","task_type":"TRACK_TARGET","target_id":"target-alpha","region_id":null,"priority":"CRITICAL","required_capabilities":[]}],
  "operating_region_id":null,"exclusion_region_ids":[]
}

